{
  "schemaVersion": 1,
  "catalogVersion": "assets-v5-complete-owner-metadata",
  "generatedAtUtc": "2026-10-01T00:00:00Z",
  "enabled": true,
  "campaigns": [
    {
      "campaignId": "2048-ball-run-v1",
      "gameId": "2048-ball-run",
      "title": "2048 Ball Run",
      "enabled": true,
      "packageName": "com.img.ballrun.game.amazon",
      "asin": "B0B9YPCB31",
      "storeWebUrl": "https://www.amazon.com/dp/B0B9YPCB31",
      "storeWebUrlsByMarketplace": {},
      "weight": 1,
      "startUtc": null,
      "endUtc": null,
      "allowedHostPackages": [],
      "excludedHostPackages": [],
      "supportedDeviceClasses": [
        "fire_tablet"
      ],
      "minAndroidApi": 22,
      "maxImpressionsPerSession": 5,
      "maxImpressionsPerUtcDay": 20,
      "creatives": [
        {
          "creativeId": "2048-ball-run-banner-v1",
          "format": "banner",
          "orientation": "any",
          "locale": "default",
          "imageUrl": "https://raw.githubusercontent.com/araheemUrbanSim/amazon-cross-promo-ads/main/creatives/2048-ball-run/v1/banner.png",
          "sha256": "f4c932bd2ab56688029f62d7b4fc0a93e99525e47c496426c39b0ee6a4ba7a05",
          "width": 1280,
          "height": 200,
          "byteSize": 309294
        },
        {
          "creativeId": "2048-ball-run-interstitial-v1",
          "format": "interstitial",
          "orientation": "portrait",
          "locale": "default",
          "imageUrl": "https://raw.githubusercontent.com/araheemUrbanSim/amazon-cross-promo-ads/main/creatives/2048-ball-run/v1/interstitial-portrait.jpg",
          "sha256": "987d194b6040aa270056e3a64a53f767ffacda077c10ca04a345c5376da6ccfe",
          "width": 1080,
          "height": 1920,
          "byteSize": 590117
        },
        {
          "creativeId": "2048-ball-run-mrec-v1",
          "format": "mrec",
          "orientation": "any",
          "locale": "default",
          "imageUrl": "https://raw.githubusercontent.com/araheemUrbanSim/amazon-cross-promo-ads/main/creatives/2048-ball-run/v1/mrec.jpg",
          "sha256": "08edd79b1358d2f97c80a52f9fa41862f0a7da1ac83613c6850b695db110dafc",
          "width": 1200,
          "height": 1000,
          "byteSize": 360196
        },
        {
          "creativeId": "2048-ball-run-interstitial-landscape-v1",
          "format": "interstitial",
          "orientation": "landscape",
          "sha256": "2cd067d389a71329eafb23ff2d9719daf3dbc1031d03c6d15f3b0409e349783c",
          "width": 1920,
          "height": 1080,
          "byteSize": 483531,
          "locale": "default",
          "imageUrl": "https://raw.githubusercontent.com/araheemUrbanSim/amazon-cross-promo-ads/main/creatives/2048-ball-run/v1/interstitial-landscape.jpg"
        }
      ]
    },
    {
      "campaignId": "american-firefighter-truck-simulator-v1",
      "gameId": "american-firefighter-truck-simulator",
      "title": "American Firefighter Truck Simulator",
      "enabled": true,
      "packageName": "com.amz.img.firefighter.fire.rescue.truck.sim.game",
      "asin": "B0CWFZB9N1",
      "storeWebUrl": "https://www.amazon.com/dp/B0CWFZB9N1",
      "storeWebUrlsByMarketplace": {},
      "weight": 1,
      "startUtc": null,
      "endUtc": null,
      "allowedHostPackages": [],
      "excludedHostPackages": [],
      "supportedDeviceClasses": [
        "fire_tablet"
      ],
      "minAndroidApi": 22,
      "maxImpressionsPerSession": 5,
      "maxImpressionsPerUtcDay": 20,
      "creatives": [
        {
          "creativeId": "american-firefighter-truck-simulator-banner-v1",
          "format": "banner",
          "orientation": "any",
          "locale": "default",
          "imageUrl": "https://raw.githubusercontent.com/araheemUrbanSim/amazon-cross-promo-ads/main/creatives/american-firefighter-truck-simulator/v1/banner.png",
          "sha256": "e83b6afac93ee746f7ae92cb81797aa02195df15db319556beda9959bce18fc9",
          "width": 1280,
          "height": 200,
          "byteSize": 331254
        },
        {
          "creativeId": "american-firefighter-truck-simulator-interstitial-v1",
          "format": "interstitial",
          "orientation": "portrait",
          "locale": "default",
          "imageUrl": "https://raw.githubusercontent.com/araheemUrbanSim/amazon-cross-promo-ads/main/creatives/american-firefighter-truck-simulator/v1/interstitial-portrait.jpg",
          "sha256": "eb4a250bb7783c52f6755cb084fc3308d5a3005ed0e3bc67b44353bb68af0f3c",
          "width": 1080,
          "height": 1920,
          "byteSize": 826079
        },
        {
          "creativeId": "american-firefighter-truck-simulator-mrec-v1",
          "format": "mrec",
          "orientation": "any",
          "locale": "default",
          "imageUrl": "https://raw.githubusercontent.com/araheemUrbanSim/amazon-cross-promo-ads/main/creatives/american-firefighter-truck-simulator/v1/mrec.jpg",
          "sha256": "8ebb9e35e3269ff2d16e51c53393ee71f3a231f02a51a4befa89f13e9f021bc6",
          "width": 1200,
          "height": 1000,
          "byteSize": 488296
        },
        {
          "creativeId": "american-firefighter-truck-simulator-interstitial-landscape-v1",
          "format": "interstitial",
          "orientation": "landscape",
          "sha256": "895e94d69a3027852b38d9fb95df4f4dfee1cf1f17b765c47a2e3b849d33c074",
          "width": 1920,
          "height": 1080,
          "byteSize": 786831,
          "locale": "default",
          "imageUrl": "https://raw.githubusercontent.com/araheemUrbanSim/amazon-cross-promo-ads/main/creatives/american-firefighter-truck-simulator/v1/interstitial-landscape.jpg"
        }
      ]
    },
    {
      "campaignId": "archery-animal-hunting-v1",
      "gameId": "archery-animal-hunting",
      "title": "Archery Animal Hunting",
      "enabled": true,
      "packageName": "com.amz.img.archery.hunt.animal.hunting.game",
      "asin": "B0H3Q7PDZK",
      "storeWebUrl": "https://www.amazon.com/dp/B0H3Q7PDZK",
      "storeWebUrlsByMarketplace": {},
      "weight": 1,
      "startUtc": null,
      "endUtc": null,
      "allowedHostPackages": [],
      "excludedHostPackages": [],
      "supportedDeviceClasses": [
        "fire_tablet"
      ],
      "minAndroidApi": 22,
      "maxImpressionsPerSession": 5,
      "maxImpressionsPerUtcDay": 20,
      "creatives": [
        {
          "creativeId": "archery-animal-hunting-banner-v1",
          "format": "banner",
          "orientation": "any",
          "locale": "default",
          "imageUrl": "https://raw.githubusercontent.com/araheemUrbanSim/amazon-cross-promo-ads/main/creatives/archery-animal-hunting/v1/banner.png",
          "sha256": "0ce9bc3f6bbe6d36106429dc84b7574f084da1a8e876077bf3fed46f45db3055",
          "width": 1280,
          "height": 200,
          "byteSize": 464214
        },
        {
          "creativeId": "archery-animal-hunting-interstitial-v1",
          "format": "interstitial",
          "orientation": "portrait",
          "locale": "default",
          "imageUrl": "https://raw.githubusercontent.com/araheemUrbanSim/amazon-cross-promo-ads/main/creatives/archery-animal-hunting/v1/interstitial-portrait.jpg",
          "sha256": "48e8233394f887df47a305487045f77195d733350b21151d02e3fce2bb161106",
          "width": 1080,
          "height": 1920,
          "byteSize": 805047
        },
        {
          "creativeId": "archery-animal-hunting-mrec-v1",
          "format": "mrec",
          "orientation": "any",
          "locale": "default",
          "imageUrl": "https://raw.githubusercontent.com/araheemUrbanSim/amazon-cross-promo-ads/main/creatives/archery-animal-hunting/v1/mrec.jpg",
          "sha256": "ebb9cc7e1f29fb568a72c8f9c47f15484a9121ead6ba2dd71dbbc826c502fede",
          "width": 1200,
          "height": 1000,
          "byteSize": 598533
        },
        {
          "creativeId": "archery-animal-hunting-interstitial-landscape-v1",
          "format": "interstitial",
          "orientation": "landscape",
          "sha256": "ebea138684aec1df4c4cc189cc9700e52dc4d8b3eb3b926f43142985cd4ec22b",
          "width": 1920,
          "height": 1080,
          "byteSize": 877001,
          "locale": "default",
          "imageUrl": "https://raw.githubusercontent.com/araheemUrbanSim/amazon-cross-promo-ads/main/creatives/archery-animal-hunting/v1/interstitial-landscape.jpg"
        }
      ]
    },
    {
      "campaignId": "call-of-us-army-sniper-duty-v1",
      "gameId": "call-of-us-army-sniper-duty",
      "title": "Call of US Army Sniper Duty",
      "enabled": true,
      "packageName": "com.amz.img.fps.commando.strike.gun.games",
      "asin": "B096MV9TST",
      "storeWebUrl": "https://www.amazon.com/dp/B096MV9TST",
      "storeWebUrlsByMarketplace": {},
      "weight": 1,
      "startUtc": null,
      "endUtc": null,
      "allowedHostPackages": [],
      "excludedHostPackages": [],
      "supportedDeviceClasses": [
        "fire_tablet"
      ],
      "minAndroidApi": 22,
      "maxImpressionsPerSession": 5,
      "maxImpressionsPerUtcDay": 20,
      "creatives": [
        {
          "creativeId": "call-of-us-army-sniper-duty-banner-v1",
          "format": "banner",
          "orientation": "any",
          "locale": "default",
          "imageUrl": "https://raw.githubusercontent.com/araheemUrbanSim/amazon-cross-promo-ads/main/creatives/call-of-us-army-sniper-duty/v1/banner.png",
          "sha256": "1ee9ef644dbd6f057f83d32b100f4083d6baa5ea4f23271b81f4600b81e008e9",
          "width": 1280,
          "height": 200,
          "byteSize": 372411
        },
        {
          "creativeId": "call-of-us-army-sniper-duty-interstitial-v1",
          "format": "interstitial",
          "orientation": "portrait",
          "locale": "default",
          "imageUrl": "https://raw.githubusercontent.com/araheemUrbanSim/amazon-cross-promo-ads/main/creatives/call-of-us-army-sniper-duty/v1/interstitial-portrait.jpg",